{
  "schemaVersion": "libre-ai.engine-golden-vectors.v1",
  "world": "boussole-scoring-v2",
  "status": "pending-architecture-security-methodology-and-privacy-review",
  "cases": [
    {
      "id": "excluded-abstentions-positive-agreement",
      "input": {
        "dataset": {
          "schemaVersion": "libre-ai.public-vote-dataset.v2",
          "id": "urn:libre-ai:dataset:votes-unit",
          "version": "2.0.0",
          "scope": "Vote public de démonstration",
          "methodId": "urn:libre-ai:method:method-unit",
          "methodDigest": "86afa940e36b8d2ff452ef6b2a7b93ae50e334b90ab9d2a7799a2f586312ee1a",
          "statements": [
            {
              "id": "statement_1",
              "wording": "Proposition sourcée statement_1",
              "source": {
                "uri": "https://example.org/vote/statement_1",
                "retrievedAt": "2026-07-16T00:00:00Z",
                "digest": "7114a5f1ab8f072738e138c5f0770deda0f60feee640e115b6523338d5ec731c",
                "licence": "Etalab-2.0"
              },
              "votesFor": 10,
              "votesAgainst": 5,
              "abstentions": 2,
              "absent": 1
            }
          ],
          "publishedAt": "2026-07-16T00:00:00Z",
          "digest": "1566d617f0ecf3e5037d061dd85d581fc024f22737dfd87aa77837f41a30f148",
          "approvals": [
            {
              "role": "methodological-review",
              "actorKind": "human",
              "reviewerId": "method_reviewer",
              "approvedAt": "2026-07-16T00:00:00Z",
              "reference": "urn:libre-ai:approval:dataset-votes-unit-method",
              "subjectDigest": "1566d617f0ecf3e5037d061dd85d581fc024f22737dfd87aa77837f41a30f148"
            },
            {
              "role": "legal-privacy-review",
              "actorKind": "human",
              "reviewerId": "privacy_reviewer",
              "approvedAt": "2026-07-16T00:00:00Z",
              "reference": "urn:libre-ai:approval:dataset-votes-unit-privacy",
              "subjectDigest": "1566d617f0ecf3e5037d061dd85d581fc024f22737dfd87aa77837f41a30f148"
            }
          ]
        },
        "method": {
          "schemaVersion": "libre-ai.boussole-method.v2",
          "id": "urn:libre-ai:method:method-unit",
          "version": "2.0.0",
          "responseScale": [-1, 0, 1],
          "abstentionTreatment": "excluded-from-denominator",
          "missingTreatment": "excluded-and-reported",
          "formula": "normalized-agreement-v2",
          "rounding": "decimal-6-half-even",
          "approvedAt": "2026-07-16T00:00:00Z",
          "digest": "86afa940e36b8d2ff452ef6b2a7b93ae50e334b90ab9d2a7799a2f586312ee1a",
          "approvals": [
            {
              "role": "methodological-review",
              "actorKind": "human",
              "reviewerId": "method_reviewer",
              "approvedAt": "2026-07-16T00:00:00Z",
              "reference": "urn:libre-ai:approval:method-method-unit-method",
              "subjectDigest": "86afa940e36b8d2ff452ef6b2a7b93ae50e334b90ab9d2a7799a2f586312ee1a"
            },
            {
              "role": "legal-privacy-review",
              "actorKind": "human",
              "reviewerId": "privacy_reviewer",
              "approvedAt": "2026-07-16T00:00:00Z",
              "reference": "urn:libre-ai:approval:method-method-unit-privacy",
              "subjectDigest": "86afa940e36b8d2ff452ef6b2a7b93ae50e334b90ab9d2a7799a2f586312ee1a"
            }
          ]
        },
        "responses": {
          "schemaVersion": "libre-ai.boussole-response-set.v2",
          "datasetId": "urn:libre-ai:dataset:votes-unit",
          "datasetDigest": "1566d617f0ecf3e5037d061dd85d581fc024f22737dfd87aa77837f41a30f148",
          "methodId": "urn:libre-ai:method:method-unit",
          "methodDigest": "86afa940e36b8d2ff452ef6b2a7b93ae50e334b90ab9d2a7799a2f586312ee1a",
          "responses": [
            {
              "statementId": "statement_1",
              "kind": "answer",
              "value": 1
            }
          ]
        },
        "computedAt": "2026-07-16T00:00:00Z"
      },
      "expected": {
        "schemaVersion": "libre-ai.local-comparison.v2",
        "datasetId": "urn:libre-ai:dataset:votes-unit",
        "datasetDigest": "1566d617f0ecf3e5037d061dd85d581fc024f22737dfd87aa77837f41a30f148",
        "methodId": "urn:libre-ai:method:method-unit",
        "methodDigest": "86afa940e36b8d2ff452ef6b2a7b93ae50e334b90ab9d2a7799a2f586312ee1a",
        "responseSetDigest": "7f8a11a136868512cf990eb38936b42236e4e273711c5bcf6cf8f35c9244cca1",
        "score": 0.333333,
        "denominator": 15,
        "omitted": 3,
        "contributions": [
          {
            "statementId": "statement_1",
            "contribution": 0.333333,
            "votesConsidered": 15,
            "votesOmitted": 3
          }
        ],
        "computedAt": "2026-07-16T00:00:00Z"
      }
    },
    {
      "id": "reject-duplicate-reviewer",
      "baseCase": "excluded-abstentions-positive-agreement",
      "patches": [
        {
          "op": "replace",
          "path": "/method/approvals/1/reviewerId",
          "value": "method_reviewer"
        }
      ],
      "expectedError": "approval-invalid"
    },
    {
      "id": "reject-zero-denominator",
      "baseCase": "excluded-abstentions-positive-agreement",
      "patches": [
        {
          "op": "replace",
          "path": "/responses/responses/0",
          "value": {
            "statementId": "statement_1",
            "kind": "skip"
          }
        }
      ],
      "expectedError": "denominator-zero"
    },
    {
      "id": "reject-invalid-computed-at",
      "baseCase": "excluded-abstentions-positive-agreement",
      "patches": [
        {
          "op": "replace",
          "path": "/computedAt",
          "value": "2026-02-30T00:00:00Z"
        }
      ],
      "expectedError": "computed-at-invalid"
    },
    {
      "id": "neutral-scale-five",
      "input": {
        "dataset": {
          "schemaVersion": "libre-ai.public-vote-dataset.v2",
          "id": "urn:libre-ai:dataset:votes-neutral-five",
          "version": "2.0.0",
          "scope": "Vote public de démonstration",
          "methodId": "urn:libre-ai:method:method-neutral-five",
          "methodDigest": "bb1c5e5199f0b6fe0a527d7dfe08cbd6785b34639a91c81ee0cb7a0e96ec575d",
          "statements": [
            {
              "id": "statement_1",
              "wording": "Proposition sourcée statement_1",
              "source": {
                "uri": "https://example.org/vote/statement_1",
                "retrievedAt": "2026-07-16T00:00:00Z",
                "digest": "7114a5f1ab8f072738e138c5f0770deda0f60feee640e115b6523338d5ec731c",
                "licence": "Etalab-2.0"
              },
              "votesFor": 10,
              "votesAgainst": 5,
              "abstentions": 5,
              "absent": 2
            }
          ],
          "publishedAt": "2026-07-16T00:00:00Z",
          "digest": "afdd2673f6c081deba94e3ad4078672c43c1dd5beb99d2b958159cf21e07fd66",
          "approvals": [
            {
              "role": "methodological-review",
              "actorKind": "human",
              "reviewerId": "method_reviewer",
              "approvedAt": "2026-07-16T00:00:00Z",
              "reference": "urn:libre-ai:approval:dataset-votes-neutral-five-method",
              "subjectDigest": "afdd2673f6c081deba94e3ad4078672c43c1dd5beb99d2b958159cf21e07fd66"
            },
            {
              "role": "legal-privacy-review",
              "actorKind": "human",
              "reviewerId": "privacy_reviewer",
              "approvedAt": "2026-07-16T00:00:00Z",
              "reference": "urn:libre-ai:approval:dataset-votes-neutral-five-privacy",
              "subjectDigest": "afdd2673f6c081deba94e3ad4078672c43c1dd5beb99d2b958159cf21e07fd66"
            }
          ]
        },
        "method": {
          "schemaVersion": "libre-ai.boussole-method.v2",
          "id": "urn:libre-ai:method:method-neutral-five",
          "version": "2.0.0",
          "responseScale": [-5, 0, 5],
          "abstentionTreatment": "neutral",
          "missingTreatment": "excluded-and-reported",
          "formula": "normalized-agreement-v2",
          "rounding": "decimal-6-half-even",
          "approvedAt": "2026-07-16T00:00:00Z",
          "digest": "bb1c5e5199f0b6fe0a527d7dfe08cbd6785b34639a91c81ee0cb7a0e96ec575d",
          "approvals": [
            {
              "role": "methodological-review",
              "actorKind": "human",
              "reviewerId": "method_reviewer",
              "approvedAt": "2026-07-16T00:00:00Z",
              "reference": "urn:libre-ai:approval:method-method-neutral-five-method",
              "subjectDigest": "bb1c5e5199f0b6fe0a527d7dfe08cbd6785b34639a91c81ee0cb7a0e96ec575d"
            },
            {
              "role": "legal-privacy-review",
              "actorKind": "human",
              "reviewerId": "privacy_reviewer",
              "approvedAt": "2026-07-16T00:00:00Z",
              "reference": "urn:libre-ai:approval:method-method-neutral-five-privacy",
              "subjectDigest": "bb1c5e5199f0b6fe0a527d7dfe08cbd6785b34639a91c81ee0cb7a0e96ec575d"
            }
          ]
        },
        "responses": {
          "schemaVersion": "libre-ai.boussole-response-set.v2",
          "datasetId": "urn:libre-ai:dataset:votes-neutral-five",
          "datasetDigest": "afdd2673f6c081deba94e3ad4078672c43c1dd5beb99d2b958159cf21e07fd66",
          "methodId": "urn:libre-ai:method:method-neutral-five",
          "methodDigest": "bb1c5e5199f0b6fe0a527d7dfe08cbd6785b34639a91c81ee0cb7a0e96ec575d",
          "responses": [
            {
              "statementId": "statement_1",
              "kind": "answer",
              "value": 5
            }
          ]
        },
        "computedAt": "2026-07-16T00:00:00Z"
      },
      "expected": {